url,category,subcategory,tanggal_publish,judul_berita,tags,konten_berita
https://www.kompas.com/edu/read/2025/11/09/080300471/cek-sekolah-kedinasan-gratis-yang-tak-bisa-didaftar-siswa-smk,Edukasi,Perguruan Tinggi,2025-11-09T08:03:00,Cek Sekolah Kedinasan Gratis yang Tak Bisa Didaftar Siswa SMK,"ipdn, Perguruan tinggi, CPNS, SMK, Sekolah Kedinasan","Masa depan lulusan SMK tak harus langsung bekerja. Lulusan jenjang SMK atau MAK juga bisa kuliah setelah menyelesaikan pendidikan. Jika memutuskan kuliah, kamu bisa ke perguruan tinggi seperti universitas, politeknik, atau yang pas buat kamu misalnya sekolah kedinasan. Sekolah kedinasan memberikan peluang bagi lulusan SMK untuk langsung jadi CPNS (Calon Pegawai Negeri Sipil) setelah lulus. Tak cuma jadi CPNS, kamu juga bisa berkuliah gratis sampai lulus. Siswa juga bisa tinggal di asrama tanpa dipungut biaya. Di Indonesia, ada 29 sekolah kedinasan dari delapan kementerian yang menawarkan kuliah gratis dan lulus langsung menjadi CPNS di kementerian atau lembaga yang menaungi sekolah kedinasan tersebut. Contohnya sekolah kedinasan di bawah naungan Kemenkeu, Kemenhub, BIN, BPS sampai Kemendagri. Sehingga dengan masuk sekolah kedinasan ada kesempatan berkarier lebih luas bagi lulusan SMK salah satunya melalui sekolah kedinasan. Tetapi dari 29 sekolah, tak semuanya bisa didaftar lulusan SMK. Ada satu sekolah kedinasan yang tak bisa didaftar siswa SMK. Mana itu? Dirangkum Kompas.com pada Sabtu (8/11/2025), sekolah kedinasan yang tak bisa didaftar siswa lulusan SMK adalah Institut Pemerintahan Dalam Negeri (IPDN). IPDN dinaungi oleh Kemendagri. Lulusannya biasanya ditempatkan di kantor pusat sampai daerah. Banyak lulusan IPDN berkarier menjadi sekretaris daerah (Sekda), camat, lurah, sampai bekerja di inspektorat. Karena kebutuhan dari IPDN sendiri, belum mencakup bidang-bidang yang dikuasi siswa lulusan SMK. Meski begitu, kamu bisa mendaftar di sekolah lain. Contohnya 22 sekolah kedinasan milik Kemenhub, STIN, STMKG, dan masih banyak lagi. Berdasarkan seleksi tahun 2025 IPDN memiliki kuota 1.061 dengan syarat sebagai berikut: 1. Warga Negara Indonesia; 2. Usia peserta seleksi minimal 16 (enam belas) tahun dan maksimal 21 (dua puluh satu) tahun pada tanggal 1 Januari 2025; dan"
https://www.kompas.com/edu/read/2025/11/09/123000071/cek-jurusan-di-7-sekolah-kedinasan-bisa-kuliah-gratis-dan-lulus-jadi-cpns,Edukasi,Perguruan Tinggi,2025-11-09T12:30:00,"Cek Jurusan di 7 Sekolah Kedinasan, Bisa Kuliah Gratis dan Lulus Jadi CPNS","gratis, Perguruan tinggi, kuliah gratis, Sekolah Kedinasan, lulus jadi cpns, siswa kelas 2 SMA","Bagi siswa kelas 12 SMA/SMK sederajat yang bersiap melanjutkan pendidikan ke jenjang kuliah, sekolah kedinasan bisa menjadi salah satu pilihan menarik. Selain dikenal dengan prospek kerja yang jelas, beberapa sekolah kedinasan di Indonesia juga membebaskan biaya pendidikan karena seluruh pembiayaan ditanggung oleh negara. Pemerintah melalui kementerian dan lembaga terkait menyediakan pendidikan kedinasan yang dibina langsung oleh negara. Umumnya, mahasiswa sekolah kedinasan tidak dipungut biaya kuliah, mendapatkan fasilitas asrama, hingga memperoleh ikatan dinas atau penempatan kerja setelah lulus. Berikut daftar sekolah kedinasan beserta jurusannya yang membebaskan biaya pendidikan untuk mahasiswanya dilansir dari laman resmi masing-masing sekolah kedinasan. PKN STAN berada di bawah naungan Kementerian Keuangan RI. Mahasiswa PKN STAN tidak dikenakan biaya pendidikan karena dibiayai negara. Program studi: Lulusan PKN STAN umumnya diangkat menjadi ASN dan ditempatkan di instansi seperti Ditjen Pajak, Ditjen Bea Cukai, Badan Pemeriksa Keuangan, serta instansi keuangan negara lainnya. Polstat STIS berada di bawah Badan Pusat Statistik (BPS). Lulusannya akan ditempatkan di BPS pusat maupun BPS daerah di seluruh Indonesia. Program studi: STIN merupakan institusi pendidikan kedinasan di bawah Badan Intelijen Negara (BIN). Lulusan STIN dipersiapkan menjadi intelijen profesional di BIN dan lembaga strategis negara. Program studi: IPDN berada di bawah Kementerian Dalam Negeri. Lulusan IPDN dipersiapkan menjadi ASN yang bekerja sebagai aparatur pemerintah pusat maupun daerah. 1. Fakultas Politik Pemerintahan 2. Fakultas Manajemen Pemerintahan"
https://www.kompas.com/edu/read/2025/11/09/153130571/pemerintah-akan-kirim-pengajar-bahasa-indonesia-ke-universitas-al-azhar,Edukasi,Perguruan Tinggi,2025-11-09T15:31:30,Pemerintah Akan Kirim Pengajar Bahasa Indonesia ke Universitas Al-Azhar Mesir,"Bahasa Indonesia, perguruan tinggi, kemendikti saintek, Universitas al azhar kairo mesir, Universitas Al Azhar Kairo, kirim pengajar bahasa indonesia ke universitas al azhar mesir","Pemerintah akan mengirim pengajar Bahasa Indonesia ke Mesir untuk mengakomodir pembukaan Program Studi (Prodi) Bahasa Indonesia di Universitas Al-Azhar Mesir. Menteri Pendidikan Dasar dan Menengah (Mendikdasmen) Abdul Mu'ti mengatakan, pihaknya akan segera berkoordinasi dengan Kedutaan Besar Republik Indonesia (KBRI) di Kairo serta Badan Bahasa Kementerian Pendidikan Dasar dan Menengah (Kemendikdasmen) terkait pengiriman pengajar Bahasa Indonesia. ""Kami memiliki program Bahasa Indonesia untuk Penutur Asing (BIPA) yang dikola Badan Bahasa Kemendikdasmen di 57 negara di dunia. Ini merupakan bagian penting dari gerakan penginternasionalan bahasa Indonesia,"" kata Mu'ti dikutip dari keterangan tertulis, Minggu (9/11/2025). Menurut Mu'ti, bahasa bukan sekadar alat komunikasi, tetapi menjadi jembatan yang mempererat hubungan kerja sama di bidang ekonomi, perdagangan, budaya dan bidang lainnya antarnegara. Sementara itu, Kepala Badan Pengembangan dan Pembinaan Bahasa (Badan Bahasa), Hafidz Muksin maupun Dubes RI untuk Mesir Lutfi Rauf juga mengaku siap menjaga kelangsungan Prodi Bahasa Indonesia di Universitas Al Azhar, Kairo. ""Ini merupakan momentum bersejarah. Penggunaan Bahasa Indonesia di sidang UNESCO beberapa waktu lalu, dan pembukaan Prodi Bahasa Indonesia di Al Azhar merupakan pengakuan yang membanggakan dan mesti kita jaga kelangsungannya,"" ujar Hafidz. Sebelumnya, pada Kamis (6/11/2025) Mendikdasmen Abdul Mu'ti mewakili pemerintah Indonesia menandatangani naskah perjanjian kerja sama dengan Rektor Universitas Al Azhar, Syaikh Salamah Daud. Dalam naskah tersebut, kedua pihak sepakat menjalin sejumlah kerja sama. Pertama mengembangkan bahan ajar bahasa Indonesia. Kedua, melakukan kajian bahasa dan sastra terhadap manuskrip-manuskrip Indonesia yang ada di Mesir. Ketiga, menyelenggarakan uji kemahiran bahasa Indonesia. Keempat, mengembangkan bahan ajar bahasa Indonesia. Kelima, bertukar dan menerjemahkan buku-buku tentang Indonesia dan Mesir. Selain itu, kedua negara juga bersepakat untuk saling menyelenggarakan kegiatan akademik dan bertukar ahli. Menurut Atase Pendidikan dan Kebudayaan KBRI Mesir, Abdul Muta'ali, bahasa Indonesia sudah digunakan sejak 2016 di Al Azhar Kairo. Namun, masih sebatas program pilihan di Fakultas Bahasa dan Terjemahan. ""Namun, sejak awal 2024, mata kuliah ini nyaris ditutup. Kami lalu menganalisis berbagai kemungkinan. Hasil analisis kami, bahasa Indonesia harus dinaikkan levelnya dari sekadar mata kuliah pilihan menjadi program studi tersendiri,"" ungkap Abdul. Ia dan tim KBRI lalu berkoordinasi dengan dekan, rektor, hingga Grand Syeikh Al Azhar (GSA), Ahmad Muhammad Ahmad At-Thayyeeb, selama lebih dari satu tahun. Lalu, terbitlah Keputusan Majelis Tinggi Al Azhar Nomor 343 tanggal 12 Juli 2025 yang memberi izin pembukaan Prodi Bahasa dan Sastra Indonesia di Universitas Al Azhar tahun akademik 2025/2026."
https://www.kompas.com/edu/read/2025/11/08/171721371/dedi-mulyadi-larang-guru-di-jabar-beri-hukuman-fisik-ke-murid,Edukasi,Sekolah,2025-11-08T17:17:21,Dedi Mulyadi Larang Guru di Jabar Beri Hukuman Fisik ke Murid,"siswa, sekolah, Dedi Mulyadi, hukuman fisik ke murid","Gubernur Jawa Barat (Jabar) Dedi Mulyadi melarang guru-guru di Jawa Barat untuk memberi hukuman fisik ke murid. Pemerintah Provinsi (Pemprov) Jabar menyebut akan mengeluarkan Surat Edaran (SE) bagi para guru. Menurut Kang Dedi, panggilan akrabnya, pemberlakuan hukuman fisik bagi murid merupakan tindakan yang berisiko melanggar aspek hukum dalam undang-undang. ""Hari ini, saya mengeluarkan surat edaran kepada seluruh guru di Jawa Barat agar hukuman anak nakal cukup dengan hal mendidik, tidak boleh hukuman fisik karena berisiko melanggar aspek hukum,"" kata Dedi Mulyadi, dikutip dari Antara, Sabtu (8/11/2025). Dedi Mulyadi berujar, pihak guru bisa mengalihkan hukuman ke hal-hal yang mendidik. Seperti membersihkan halaman, toilet, mengecat tembok, membersihkan kaca, atau membantu tugas sekolah lain. Kebijakan ini dikeluarkan menyusul kejadian perselisihan antara orangtua salah satu murid dan guru di Sekolah Menengah Pertama (SMP) di Subang akibat hukuman tamparan yang diberikan. Lebih lanjut, Dedi menyebut terdapat sekitar dua ratus pengacara di Jawa Barat yang siap mendampingi para guru Sekolah Menengah Atas (SMA) dan Sekolah Menengah Kejuruan (SMK) jika mereka menghadapi permasalahan hukum. ""Selain itu di Jawa Barat sudah ada sekitar dua ratus pengacara yang siap mendampingi para guru SMA dan SMK jika menghadapi masalah hukum,"" jelasnya. Sementara itu Pemprov Jabar mewajibkan seluruh orangtua murid menandatangani surat pernyataan dukungan terhadap penerapan disiplin di sekolah. Pemprov Jabar akan mengembalikan siswa kepada orangtuanya apabila ia menolak mengikuti aturan dan sanksi yang berlaku. Ini upaya membentuk pola pikir pendidikan yang lebih bertanggung jawab di Jawa Barat."
https://www.kompas.com/edu/read/2025/11/08/185500671/sekolah-di-belanda-bentuk-penerbit-nirlaba-agar-cetak-buku-pelajaran-lebih,Edukasi,Sekolah,2025-11-08T18:55:00,Sekolah di Belanda Bentuk Penerbit Nirlaba agar Cetak Buku Pelajaran Lebih Murah,"belanda, siswa, sekolah, buku pelajaran, sekolah di Belanda, penerbit nirlaba","Puluhan dewan sekolah di Belanda membentuk penerbit Neon agar membuat materi dalam buku pelajaran lebih murah, lebih fleksibel, dan lebih sesuai dengan kebutuhan siswa. Langkah ini diambil dengan tujuan untuk menghalau dominasi empat penerbit buku teks utama di Negeri Kincir Angin. Neon merupakan kependekan dari Nederlands Onderwijsinstituut. Neon juga diharapkan mampu menyatukan sekitar 50 dewan sekolah, yang artinya mewakili setengah juta siswa atau seperlima dari seluruh siswa sekolah dasar dan menengah Belanda pada akhir tahun ini. Pendiri Neon, Marten Blankesteijn yang sebelumnya bekerja di penerbit Noordhoff, mengatakan ia terkejut dengan betapa sulitnya berinovasi untuk dilakukan oleh penerbit tradisional. ""Guru dapat menyusun ulang bab, menambahkan contoh, atau mempersingkat bagian hanya dengan beberapa klik,"" ujarnya kepada NOS. ""Kami mengembalikan kendali kepada dunia pendidikan,"" ujar Marten, dikutip dari DutchNews, Sabtu (8/11/2025). Sekolah perlu membayar sekitar 20 Euro (Rp 386.000) per murid per tahun untuk materi ajar Neon. Dibandingkan dengan rata-rata biaya di penerbit umum saat ini sebesar 300 Euro (Rp 5,8 juta). Sebanyak 45 penulis dan insinyur perangkat lunak akan mulai bekerja di Neon bulan ini. Perangkat lunak Neon akan secara otomatis mengonversi perubahan-perubahan menjadi pelajaran digital atau PDF yang dapat dicetak. Sekolah-sekolah juga dapat berbagi dan menggunakan kembali materi satu sama lain melalui perpustakaan Neon yang terpusat. ""Ini akan menjadi terobosan. Ini lebih berkelanjutan, lebih murah, dan meningkatkan kualitas,"" kata Annet Kil dari Gooise Scholen Federatie. Saat ini, 12 dewan terlibat dalam proyek ini dan mewakili 70.000 siswa. Sebagai informasi, empat penerbit yakni Noordhoff, Malmberg, ThiemeMeulenhoff dan Zwijsen saat ini menguasai sekitar 80 persen pasar buku sekolah di Belanda. Menteri Pendidikan Muda Belanda, Koen Becking mengatakan ia mengamati perkembangan Neon dengan penuh minat. ""Jika ini meningkatkan pilihan dan meningkatkan kualitas serta keterjangkauan, itu hal yang baik,"" ujarnya."
https://www.kompas.com/edu/read/2025/11/09/124500271/kemkomdigi-ajak-santri-jadi-sahabat-tunas-cegah-bullying-di-medsos,Edukasi,Sekolah,2025-11-09T12:45:00,"Kemkomdigi Ajak Santri Jadi Sahabat Tunas, Cegah Bullying di Medsos","media sosial, sekolah, santri, medsos, cegah bullying, Komdigi, Kemkomdigi, sahabat tuntas","Kementerian Komunikasi dan Digital (Kemkomdigi) memastikan kalau seluruh siswa termasuk santri harus mengerti ruang aman. Ruang aman ini, artinya siswa dan santri bisa terlibat secara aktif tidak melakukan dan mencegah bullying di media sosial. Direktorat Jenderal Komunikasi Publik dan Media (KPM) Kemkomdigi Fifi Aleyda Yahya mengatakan Komdigi terus membuat program hasil implementasi PP Tunas. PP Tunas adalah singkatan dari Peraturan Pemerintah Nomor 17 Tahun 2025 tentang Tata Kelola Penyelenggaraan Sistem Elektronik dalam Pelindungan Anak, yang bertujuan untuk melindungi anak-anak dari bahaya di ruang digital seperti media sosial dan game online. Regulasi ini dibuat oleh pemerintah Indonesia dan ditandatangani oleh Presiden RI Prabowo Subianto pada 28 Maret 2025. Komdigi mewujudkan peraturan ini dalam bentuk Sahabat Tunas. Program ini mendukung menciptakan ruang digital yang aman dan ramah anak, sekaligus mendukung implementasi PP Tunas. Direktur Jenderal KPM Kemkomdigi, Fifi Aleyda Yahya, mengatakan literasi digital bagi anak jauh melampaui sekadar kemampuan teknis. ""Melalui kegiatan Sahabat Tunas, kami mengajak anak-anak belajar tentang hak dan kewajiban sebagai anak digital yang cerdas dan bertanggung jawab, dan kepada orangtua untuk selalu mengawasi kegiatan digital anak-anak mereka,"" ujar Fifi Aleyda Yahya, dilansir dari rilis Komdigi. Ia menambahkan, pendampingan harus dilakukan secara seimbang. Anak perlu memahami batasan konten yang boleh mereka akses, mampu membagi waktu antara belajar dan berkreasi di dunia online, serta tetap aktif bersosialisasi di dunia nyata. Seperti di Pondok Pesantren Assalafiyyah di Mlangi, Yogyakarta, Jumat (7/11/2025), Komdigi menggandeng dalang cilik, Adimas Alby Elsani Widyaputra untuk mensosialisasikan program ini. Melalui lakon yang interaktif, Adimas menyampaikan bahwa PP Tunas adalah bukti kehadiran negara dalam melindungi anak-anak di ruang digital. Wayang, sebagai seni yang akrab dengan budaya pesantren, dipilih sebagai sarana yang efektif untuk menyampaikan pesan moral tentang tanggung jawab kolektif dalam menjaga ruang digital agar tetap ramah bagi anak. Tidak hanya wayang, kegiatan yang diikuti hampir 300 siswa SD dan MTs ini juga dimeriahkan oleh kesenian silat, permainan tradisional seperti congklak dan enggrang, serta pameran aplikasi dan gim karya santri. Pertunjukan dalang cilik dan beragam aktivitas alam nyata menunjukkan bahwa SAHABAT TUNAS tidak hanya berfokus pada dunia digital, tetapi juga mendorong anak untuk terlibat dalam kegiatan positif dan produktif di luar layar gawai."
https://www.kompas.com/edu/read/2025/11/09/132020871/psikolog-tika-bisono-maraknya-bullying-dan-kekerasan-tanda-gagalnya-semua,Edukasi,Sekolah,2025-11-09T13:20:20,Psikolog Tika Bisono: Maraknya Bullying dan Kekerasan Tanda Gagalnya Semua Pihak,"siswa, sekolah, bullying, psikolog, kekerasan, dampak bullying, tika bisono","Menjelang penghujung tahun 2025 isu bullying dan kekerasan di sekolah malah kian terjadi di ranah pendidikan Indonesia. Komisi Perlindungan Anak Indonesia (KPAI) mencatat hingga akhir Oktober terdapat 25 kasus anak bunuh diri. Pada 7 November ledakan terjadi di empat titik di SMAN 27 di Jakarta Utara yang menyebabkan puluhan siswa luka-luka. Pelaku peledakan diduga merupakan siswa korban bullying. Dugaan ini muncul dari keterangan siswa lain. ""Selama ini dengar kalau dia pernah di-bully. Dia juga terkenal pendiam. Dia sering di kelas aja,"" kata R (16) kepada Kompas.com usai kejadian. ""Tapi akhir-akhir ini kita tidak tahu apakah dia kena bully lagi atau tidak,"" lanjut dia. Sepekan sebelumnya, seorang santri membakar pesantrennya di Kabupaten Aceh Besar, Provinsi Aceh pada 31 Oktober lantaran tidak tahan terus-terusan menjadi korban bullying teman-temannya. Beberapa kasus guru dan kepala sekolah mencoba memberikan hukuman kepada murid yang melanggar aturan tetapi dengan tindak kekerasan pun terjadi hingga berujung laporan ke polisi. Menyoroti maraknya kasus bullying dan kekerasan di sekolah, psikolog Tika Bisono menilai hal tersebut merupakan kegagalan seluruh pihak dari pemerintah sang pembuat kebijakan hingga rekan sejawatnya. ""Kalau melihat data ya, itu berarti semua gagal kerja. Termasuk para psikolog kayak saya-saya ini,"" ucap Tika Bisono dalam sambungan telepon kepada Kompas.com, Sabtu (8/11/2025). Menurut Tika, lembaga-lembaga yang dibentuk pemerintah untuk memastikan perlindungan bagi anak-anak di Indonesia belum benar-benar bekerja. ""Badan-badan kayak KPAI itu emang enggak jalan. Itu cuma ngumpulin data doang. Tapi tidak actually you're doing something. Misalnya ada hotline service atau kayak 911,"" kata Tika. Ia menilai kebijakan dari pemerintah tidak tegas. Sedangkan yang punya dan bisa membuat kebijakan publik hanyalah pemerintah. Bukan cuma individu yang bisa diberikan sanksi tetapi satuan pendidikan pun patut mendapatkannya sebagai efek jera. ""Pemerintah tuh amoral, nggak bermoral. Dikbud (sekarang Kemendikdasmen dan Kemdiktisaintek) misalnya, ada sanksi kek kalau sekolah-sekolah itu ada kekerasan gitu. Artinya tipe kekerasan apapun ya. Ya guru ke guru, guru ke siswa, siswa ke siswa. Apapun disanksiin, satu tahun enggak boleh terima siswa atau BOS-nya dikurangin,"" tutur Tika."
https://www.kompas.com/edu/read/2025/11/09/145733971/kalau-ada-aksi-bullying-di-sma-apa-sanksinya-ini-kata-para-guru,Edukasi,Sekolah,2025-11-09T14:57:33,"Kalau Ada Aksi Bullying di SMA, Apa Sanksinya? Ini Kata Para Guru","guru, sekolah, bullying, perundungan, cegah bullying, cegah bullying di sekolah, pencegah bullying","Motif terduga pelaku peledakan SMAN 72 Jakarta, disebut karena menjadi korban bullying atau perundungan di kelasnya. Menurut informasi yang beredar, terduga pelaku nekat melakukan aksi tersebut karena dendam setelah diduga kerap menjadi korban perundungan. Kasus perundungan di sekolah, beberapa kali terjadi di Indonesia. Masalah bullying adalah isu yang melibatkan semua pihak, termasuk sekolah. Tak jauh dari kasus ledakan di SMAN 72 Jakarta, Seorang santri di Dayah (Pesantren) Babul Maghfirah, Kabupaten Aceh Besar, nekat membakar asrama tempatnya belajar pada Jumat (31/10/2025). Dilansir dari laman Kompas.com, aksi itu dilakukan karena ia mengaku sering menjadi korban perundungan oleh teman-temannya. Kebakaran tersebut melahap gedung asrama putra dan menjalar hingga ke bangunan kantin serta rumah salah satu pembina yayasan. Guru Bimbingan Konseling SMA Brawijaya Smart School (SMA BSS) Murtiningtyas Nuswantari, mengatakan sekolah tentu harus memiliki program yang mencegah bullying terjadi. ""Masalah pembullyian ini memang menjadi PR besar bagi kami para pendidik karena media bullying sekarang lebih terbuka dibandingkan jaman dulu,"" kata guru yang akrab disapa Nining, ketika dihubungi Kompas.com, Sabtu (9/11/2025). Meski tantangan perundungan atau bullying bisa terjadi kapan saja, ia mengatakan sekolah harus siap kapanpun. Beberapa program anti-bullying yang diterapkan di sekolahnya. Misalnya memberikan pemaparan materi terkait dampak bullying bagi pelaku dan korban, sampai dengan sharing pengalaman psikolog/dosen psikologi yang menangani kasus bullying. ""Termasuk menerapkan poin minus kepada pelaku bullying,"" tambah dia. Ia mengatakan sebagai guru BK, selalu menyampaikan dan mengingatkan tentang dampak bullying bagi korban dan pelaku dalam materi layanan di kelas. ""Kami selalu berusaha untuk menjalin komunikasi dengan murid agar terjadi komunikasi yang terbuka antara murid dan kami sebagai guru BK sehingga jika ada informasi terkait bullying atau apapun itu, bisa tersampaikan ke kami,"" tambahnya. Nining menyebut, salah satu tindakan yang juga wajib dilakukan di sekolah adalah mendampingi murid-murid yang rawan menjadi korban bullying dengan terus menjalin komunikasi dan memberikan penguatan. ""Mereka kami beri materi terkait asertivitas agar murid berani menolak dan berani menyampaikan apa yang ia dibutuhkan agar terhindar menjadi korban bullying,"" kata dia."
https://edukasi.kompas.com/read/2023/01/29/145819971/4-cara-memilih-sekolah-yang-tepat-untuk-anak-autis,Edukasi,Pendidikan Khusus,2023-01-29T14:58:19,4 Cara Memilih Sekolah yang Tepat untuk Anak Autis,"sekolah, autisme, anak berkebutuhan khusus, anak autis, pendidikan khusus","Anak-anak autis termasuk anak dengan disabilitas mental. Meski secara fisik terlihat normal, namun anak autis biasanya mengalami hambatan dalam berkomunikasi hingga berinteraksi sosial. Orangtua yang memiliki anak dengan autisme juga perlu memperhatikan pendidikan yang tepat untuk buah hatinya. Karena memiliki karakter berbeda, anak autis membutuhkan pendekatan dan metode belajar berbeda. Melansir dari laman sekolah inklusi di Jakarta, Cherish Academy, Minggu (29/1/2023) menyampaikan informasi mengenai hal-hal yang perlu diperhatikan dalam memilih sekolah yang tepat bagi anak autis. Sebelum tahu cara memilih sekolah yang tepat, orangtua perlu mengetahui terlebih dahulu karakteristik anak-anak autis. Pemahaman karakteristik anak ini sangat berkaitan dengan proses belajarnya nanti. Karakteristik tersebut di antaranya adalah: Seperti diketahui bersama, anak-anak spesial bisa bersekolah di sekolah inklusi (sekolah umum yang juga menerima anak berkebutuhan khusus), sekolah luar biasa (SLB), atau home schooling. Untuk menentukan sekolah mana yang terbaik bagi anak autis, orangtua perlu memperhatikan beberapa hal berikut ini: 1. Lingkungan sekolah harus ramah ABK Salah satu poin penting yang wajib diperhatikan orangtua dalam memilih sekolah untuk anak autis adalah sekolah harus ramah anak berkebutuhan khusus. Jika tidak, anak akan berisiko mengalami tindakan bullying atau disisihkan dari pergaulan. 2. Sesuaikan dengan kondisi anak Ada tiga hal pokok yang perlu dinilai dari seorang anak penyandang autis, yaitu hambatan sosialisasi, hambatan komunikasi, dan gangguan perilaku. Hambatan yang dialami juga berbeda, ada yang ringan hingga berat. Para pakar menyarankan bagi anak yang tingkat autismenya ringan dan memiliki kemampuan kognitif cukup baik bisa bersekolah di sekolah inklusi. Sedangkan mereka yang kondisinya berat dan kemampuan kognitifnya kurang sebaiknya bersekolah di SLB ataupun home schooling. 3. Lakukan terapi lebih dahulu"
https://edukasi.kompas.com/read/2023/02/24/155650571/orangtua-pahami-ini-sebelum-masukkan-anak-berkebutuhan-khusus-ke-sekolah,Edukasi,Pendidikan Khusus,2023-02-24T15:56:50,Orangtua Pahami Ini Sebelum Masukkan Anak Berkebutuhan Khusus ke Sekolah,"sekolah, anak berkebutuhan khusus, pendidikan khusus, anak disabilitas","Masih banyak masyarakat atau orangtua yang belum terlalu memahami perbedaan antara sekolah luar biasa atau SBK dan sekolah (umum) inklusi. Dan, mana yang lebih cocok untuk anak berkebutuhan khusus (ABK)? Mengenai hal ini, dosen Pendidikan Luar Biasa (PLB), Universitas Negeri Surabaya (Unesa), Muhammad Nurul Ashar punya pendapat yang bisa jadi referensi orangtua. Ashar menjelaskan, sekolah ABK terbagi menjadi dua jenis yakni sekolah umum inklusi, yang menyediakan pelayanan bagi siswa disabilitas dan ada sekolah luar biasa atau biasa disebut SLB. Menurut dia, sekolah umum inklusi secara regulasi tidak ada SK yang menetapkan sekolah inklusi atau tidak, tetapi berdasarkan komitmen, layanan dan sumber daya di sekolah. Sekolah inklusi bagus buat ABK karena bisa mereka bisa belajar sosialisasi dengan lingkungan umum yang diharapkan menjadi bekal saat mereka terjun di tengah masyarakat dan siap mandiri. ""Namun yang jadi tantangannya di sekolah umum tentu terkait keterbatasan guru ABK, sarana-prasarana hingga pembelajaran atau pembinaan yang mungkin tidak benar-benar khusus sesuai kebutuhan anak. Selain itu ya masih ditemukannya bullying pada ABK,"" ucap dia mengutip laman Unesa, Jumat (24/2/2023). Selain itu juga berkaitan dengan aksesibilitas dan infrastruktur yang bisa saja tidak seluruhnya ramah disabilitas. ""Banyak juga sekolah umum yang tidak berani ABK karena keterbatasan SDM, apalagi kalau zonasi. Kalau SDM kurang tentu pembinaannya pun kurang maksimal,"" lanjut dia. SLB merupakan sekolah yang dirancang khusus untuk anak berkebutuhan khusus. Tentu mulai dari infrastruktur, SDM, sistem pembelajaran dan semua aspek disiapkan untuk menunjang tumbuh dan berkembangnya ABK. SLB belakangan semakin berkembang, ada yang SLB khusus autis, tunanetra, tunarungu dan sebagainya. Dan ini tentu semakin memberikan spesialisasi bagi masing-masing anak disabilitas. Nah, SLB ini tentu berdasarkan SK. Sekolah ini sudah banyak dan terus bertambah di berbagai daerah. ""Sayangnya dari data dapodik ketersediaan SLB seluruh indonesia hanya berkisar ratusan sekolah dan banyak berpusat di Jawa. SLB berstatus negeri juga sangat sedikit sehingga bagi orangtua dengan kondisi ekonomi kurang harus mempertimbangkan biaya jika masuk SLB swasta,"" ucap dia. Bagi penyandang autism, Ashar menyarankan orangtua untuk memahami kebutuhan dan kemampuan anaknya terlebih dahulu."
