url,category,subcategory,tanggal_publish,judul_berita,tags,konten_berita
https://otomotif.kompas.com/read/2025/11/03/094200515/toyota-bz-time-attack-concept--mobil-listrik-balap-di-sema-2025,Otomotif,Modifikasi,2025-11-03 09:42:00,Z Time Attack Concept: Mobil Listrik Balap di SEMA 2025.,"mobil balap listrik, SEMA Show 2025, Toyota bZ Time Attack, performa ekstrem","Toyota mendorong batas performa kendaraan listrik dengan memperkenalkan bZ Time Attack Concept, mobil balap listrik penuh (BEV) pertama mereka yang dirancang khusus untuk menghadapi tantangan time attack dan hill climb. Dikutip dari Pressroom. toyota. com, Minggu (2/11/2025), debut perdana mobil konsep ini akan berlangsung di SEMA Show 2025, ajang modifikasi dan inovasi otomotif terbesar di dunia. Dibangun dari basis Toyota bZ AWD model year 2026, bZ Time Attack Concept menjadi bukti nyata bahwa teknologi elektrifikasi Toyota tak hanya soal efisiensi, tetapi juga tentang performa ekstrem dan keandalan di lintasan. Toyota merancang bZ Time Attack Concept untuk mengeksplorasi potensi performa BEV generasi terbaru. Mobil ini mengusung aerodinamika kompetisi, suspensi berstandar motorsport, serta peningkatan tenaga listrik yang signifikan dibanding versi standar. Sebagai basis, bZ AWD 2026 sudah mampu menghasilkan 338 hp dan berakselerasi 0–100 km/jam dalam 4, 9 detik. Namun, dalam versi konsep ini, Toyota menyalurkan tenaga lebih dari 300 kW (setara 400 hp) ke empat roda melalui motor listrik yang dikalibrasi ulang oleh tim riset dan pengembangan Toyota. Toyota juga memastikan bahwa performa ekstrem ini tetap relevan dengan arah masa depan perusahaan. Mulai tahun 2026, Toyota akan memperluas jajaran BEV global dengan model baru, termasuk bZ Woodland dan C-HR BEV, dengan jangkauan dan kemampuan pengisian daya yang lebih baik. “Tahun ini di SEMA, kami ingin menjelajahi wilayah yang belum pernah dieksplorasi sebelumnya, ” kata Marty Schwerter, Lead Builder dan Director of Operations di Toyota Motorsports Technical Center. “Ini adalah kesempatan untuk menjelajahi, belajar, dan menciptakan sesuatu yang menunjukkan betapa besar potensi yang ada dalam platform BEV Toyota, ” ujar Schwerter. Schwerter dan tim Toyota Motorsports Garage dikenal berpengalaman dalam proyek-proyek SEMA selama lebih dari dua dekade. Namun, menurutnya, proyek kali ini menghadirkan tantangan baru, mulai dari menyeimbangkan performa baterai dan distribusi bobot, hingga merancang paket bodi lebar dan aerodinamis yang sesuai untuk motorsport berbasis listrik. “Tujuannya bukan sekadar menciptakan mobil pameran, melainkan untuk melihat sejauh mana platform bZ baru dapat dioptimalkan dalam lingkungan balap mobil, dan itu berarti kami harus mengatasi dua tantangan terbesar bagi mobil balap listrik, kinerja baterai dan integrasi aerodinamis, ” kata Schwerter. Penerapan bodi lebar dan sistem aerodinamika penuh pada platform EV membawa tantangan baru."
https://otomotif.kompas.com/read/2025/11/03/120200315/mugen-hadirkan-paket-modifikasi-buat-civic-type-r-harga-rp1-miliar,Otomotif,Modifikasi,2025-11-03 12:02:00,"Mugen Hadirkan Paket Modifikasi Buat Civic Type R, Harga Rp1 Miliar.","modifikasi, Civic Type R, mobil , mugen, bodykit","Setelah tampil di Tokyo Auto Salon 2025, tuner legendaris Honda, Mugen, resmi meluncurkan paket modifikasi dengan nama Group. B untuk Civic Type R. Modifikasi ini bukan cuma ubahan kosmetik, tapi juga peningkatan aerodinamika, bobot yang lebih ringan, dan suara mesin yang makin agresif. Dengan biaya modifikasi yang ditawarkan hampir dua kali lipat dari harga Civic Type R standar di Jepang. Soal eksterior, di bagian depan, ada ekstensi bumper dengan splitter besar, kap mesin berventilasi, dan lubang udara bergaya GT3 di fender. Desain ini diteruskan ke side skirt tajam, sayap belakang besar dengan tambahan lip spoiler, dan diffuser yang mengapit satu pipa knalpot tengah. Mugen mengklaim paket ini mampu menghasilkan tiga kali lebih banyak downforce dibanding versi standar, sekaligus memangkas bobot mobil hingga 38 kilogram berkat material serat karbon yang digunakan di berbagai panel. Mesinnya masih mengandalkan unit turbo 2. 0 liter empat silinder, tapi kini mendapat penutup mesin karbon dengan logo Mugen sebagai sentuhan eksklusif. Sementara itu, sistem knalpot titanium bikin bobot berkurang lagi sekitar 8, 75 kilogram, dan memberikan sedikit tambahan torsi di putaran menengah. Tak cuma itu, Mugen juga menawarkan paket rem baru yang dirancang untuk memberikan daya cengkeram lebih kuat dan ketahanan lebih baik saat mobil diajak ngebut di sirkuit. Soal harga, Mugen enggak main-main. Dikutip dari Carscoops, Senin (3/10/2025), total biayanya mencapai 9. 630. 000 Yen atau sekitar Rp 1 miliar. Padahal, harga Civic Type R standar di Jepang hanya 4. 997. 300 Yen, atau sekitar Rp 500 jutaan. Artinya, kalau semua komponen Mugen ini dipasang, total harga mobil bisa tiga kali lipat lebih mahal dari harga mobil yang sesunguhnya."
https://otomotif.kompas.com/read/2025/11/04/092200515/modifikasi-suzuki-jimny-berwajah-toyota-rangga,Otomotif,Modifikasi,2025-11-04 09:22:00,Modifikasi Suzuki Jimny Berwajah Toyota Rangga.,"modifikasi, mobil , suzuki jimny, Suzuki , Toyota Rangga","Kehadiran Toyota Hilux Champ atau yang dikenal dengan Toyota Rangga untuk pasar Indonesia cukup menarik banyak perhatian. Dengan wajah yang khas, lampu depan kotak dan gril sederhana Toyota Rangga mampu menginspirasi modifikasi Suzuki Jimny di Jepang. Melalui tangan kreatif tuner ill Garage, Suzuki Jimny tampil dengan wajah baru bergaya Toyota Rangga. Pada bagian depan, desain Jimny berubah total. Lampu bulat khasnya diganti dengan lampu utama kotak, gril bergaya sederhana dengan tulisan CH: AMP berwarna merah, dan bumper dua bagian yang mengingatkan pada desain praktis Toyota. Wajah baru ini memberikan kesan fungsional namun tetap tegas, seolah meniru karakter Land Cruiser FJ versi modern. Seluruh komponennya diberi warna hitam doff agar selaras dengan fender lebar dan bagian atap. Mobil tersebut juga memakai pelek aftermarket dengan ban bertapak besar, serta per rendah yang menurunkan tinggi mobil sekitar 38 mm. Ada juga dummy towing hook yang membuat kesan gagah mobil off-road semakin kental. Masuk ke dalam kabin, ill Garage menawarkan sarung jok bergaya retro dengan pilihan warna Cognac Brown atau Charcoal Black. Jok ini dibuat dari kombinasi kulit dan anyaman, lengkap dengan kantong penyimpanan di belakang kursi untuk menambah kepraktisan. Paket ubahan ini tersedia untuk Jimny tiga pintu dan Jimny lima pintu. Konsumen bisa memilih untuk membeli satu per satu komponennya, atau langsung menyerahkan seluruh proses konversi ke ill Garage, termasuk memesan unit Jimny baru. Bicara soal harga, dikutip dari Carscoops, Senin (3/11/2025), untuk paket standar dibanderol mulai 360. 800 Yen atau ssekitar Rp 35 juta dengan lampu halogen, sedangkan versi lampu LED dijual 386. 100 Yen atau sekitar Rp37 juta."
https://otomotif.kompas.com/read/2025/11/06/112200415/modifikasi-land-cruiser-jadi-lebih-agresif--pakai-bodykit-liberty-walk,Otomotif,Modifikasi,2025-11-06 11:22:00,Modifikasi Land Cruiser Jadi Lebih Agresif: Pakai Bodykit Liberty Walk.,"modifikasi, Modifikasi mobil, Land Cruiser, Liberty Walk, bodykit","Toyota Land Cruiser memang dikenal sebagai Sport Utility Vehicle (SUV) tangguh yang mengutamakan durabilitas, bukan performa agresif. Namun, hal tersebut tidak menghentikan rumah modifikasi asal Jepang, Liberty Walk, untuk memberikan sentuhan baru yang lebih nyentrik pada model tersebut. Ubahan yang dilakukan membuat Land Cruiser tampil mencolok, cocok menjadi pesaing dari Mercedes-Benz AMG G63. Dikutip dari Carscoops, Kamis (6/11/2025), modifikasi ini pertama kali dipamerkan dalam ajang SEMA Show di Las Vegas. Liberty Walk sebenarnya sudah pernah menggarap Land Cruiser 300. Namun, kali ini mereka menyasar model Land Cruiser 250 Series, yang dikenal sebagai Prado di sejumlah pasar. Meski bukan yang pertama mengadopsi gaya sporty pada Land Cruiser, pendekatan yang ditawarkan Liberty Walk tampak lebih ekstrem dibandingkan sentuhan dari Wald maupun Tom’s Racing sebelumnya. Pada bagian depan, Liberty Walk memasangkan bumper baru dengan desain intake udara lebih besar serta DRL terintegrasi. Kap mesin juga mendapat panel tambahan sebagai aksen visual. Untuk bagian samping, karakter khas Liberty Walk terlihat dari penggunaan over fender lebar berbaut, sementara bagian belakang memperoleh bumper extension, diffuser, spoiler pada pintu bagasi, serta sayap belakang yang cukup besar. Kesan premium turut diperkuat lewat penggunaan lampu LED Alpharex Nova Series di bagian depan dan belakang. SUV ini menggunakan pelek forged alloy berdiameter 24 inci dari Vossen, dipasangkan dengan ban Toyo Tires Proxes ST III yang dirancang untuk SUV dan truk performa. Meski Liberty Walk tidak membeberkan pembaruan pada sektor sasis, terlihat bahwa mobil ini sudah mendapatkan suspensi lebih rendah serta penambahan spacer untuk memperlebar jejak roda. Namun, seluruh ubahan yang dipamerkan di SEMA hanya sebatas kosmetik. Tidak ada peningkatan performa mesin. Untuk pasar Amerika Serikat, Land Cruiser menggunakan mesin hybrid 2. 4 liter turbo i-FORCE MAX yang menghasilkan tenaga 326 hp dan torsi 630 Nm, dipadukan transmisi otomatis 8-percepatan dan sistem 4WD. Sementara di pasar lain, Land Cruiser masih tersedia dengan pilihan mesin bensin atau diesel. Berdasarkan situs resmi Liberty Walk, paket bodykit lengkap ditawarkan dengan harga 8. 800 dolar AS atau sekitar Rp 146 juta. Adapun pelek Vossen berukuran 24 inci dibanderol 14. 850 dolar AS atau sekitar Rp 247 juta."
https://otomotif.kompas.com/read/2025/11/06/120200415/mobil-listrik-china-mulai-gerus-bisnis-aftermarket,Otomotif,Modifikasi,2025-11-06 12:02:00,Mobil Listrik China Mulai Gerus Bisnis Aftermarket.,"otomotif, modifikasi, aftermarket, Aftermarket Otomotif, kendaraan","Ramainya penetrasi mobil listrik asal China di Indonesia, mulai membawa dampak nyata ke sektor hilir industri otomotif, salah satunya pada bisnis aksesori alias aftermarket mobil. Menurut Ayong Jeong, CEO sekaligus Founder Kramat Motor di Jakarta Utara, penjualan komponen seperti head unit, amplifier, dan speaker kini turun tajam karena mobil listrik sudah dilengkapi sistem audio canggih bawaan pabrikan. “Untuk tiga item itu, yakni head unit, speaker, amplifier, kalau untuk EV hampir zero. Hampir tidak terjadi (penjualan), ” ujar Ayong saat ditemui akhir pekan lalu. Ayong menjelaskan, berbeda dengan mobil konvensional, mobil listrik asal China umumnya sudah dibekali fitur hiburan yang sangat lengkap sejak keluar dari pabrik. Sistem head unit -nya sudah menyatu dengan komputer utama mobil (Electronic Control Unit/ECU), sehingga tidak bisa diganti atau dimodifikasi. “Mobil EV itu datang, speaker sudah bagus, power -nya ada, head unit -nya sudah besar-besar. Tapi head unit -nya tidak bisa diganti karena link ke ECU, ” katanya. Kondisi ini membuat pasar aftermarket menurun tajam. Konsumen yang sebelumnya sering melakukan upgrade sistem suara kini memilih mempertahankan kondisi bawaan mobil, baik karena keterbatasan teknis maupun khawatir garansi akan hangus jika ada perubahan pada sistem kelistrikan. “Pemain head unit sekarang pangsanya tinggal di mobil second-hand. Bersyukur Indonesia belum menerapkan aturan scrap car, jadi mobil tua masih banyak, ” ujarnya. Ia mencontohkan, pemilik mobil keluaran lama lebih memilih memperbarui sistem audio dan interior daripada menjual mobilnya. “Daripada dijual, mending audio-nya dibagusin, jok-nya dibagusin. Itu bisnis kita sekarang, ” kata dia. Dengan makin sempitnya ruang di pasar audio, Ayong mengaku, pihaknya mulai menggeser fokus ke segmen lain, seperti aksesori eksterior dan perlengkapan elektronik tambahan. “Jadi mau tidak mau, main ke non-elektronik yang tidak terhubung ke ECU dan CPU, misalnya lampu, grill, body kit, sampai kamera 360 derajat, ” ucapnya. Namun, persaingan di segmen itu pun tidak mudah. Banyak mobil listrik asal China yang sudah dilengkapi fitur lengkap, termasuk sistem kamera 360 dan sensor parkir. Ayong menambahkan, dampak penurunan penjualan di segmen audio aftermarket mulai terasa sejak awal 2024, seiring meningkatnya penjualan mobil listrik seperti Chery hingga BYD di Indonesia. “Sekarang penjualannya mereka gila-gilaan. Dari situ mulai terasa, bisnis aftermarket turun, ” ungkapnya. Meski begitu, Ayong menilai tren ini merupakan konsekuensi logis dari kemajuan teknologi kendaraan. Industri aftermarket, menurutnya, perlu cepat beradaptasi agar tetap bertahan."
https://otomotif.kompas.com/read/2025/11/06/181200515/honda-bikin-civic-type-r-jadi-mobil-reli,Otomotif,Modifikasi,2025-11-06 18:12:00,Honda Bikin Civic Type R Jadi Mobil Reli.,"Honda, Civic Type R, sedan sport, Honda Racing Corporation, mobil reli","Honda resmi memperkenalkan Civic Type R HRC Rally XP, yang merupakan mobil reli terbaru danmenandai ekspansi divisi balap Honda Racing Corporation (HRC) ke dunia reli. Dikutip dari Hondanews. com, Kamis (6/11/2025), mobil ini menjalani debut global setelah melalui serangkaian pengujian off-road di Texas bersama pebalap Formula 1 Liam Lawson, untuk memastikan daya tahan dan kemampuannya di lintasan ekstrem. Rally XP dibangun dari pengalaman panjang HRC di ajang touring car serta pengembangan mobil reli HART Acura Integra. Honda juga menggandeng Rally Ready, tim reli asal Amerika Serikat, untuk menyempurnakan karakter dan performanya. Meski berorientasi pada reli, mobil ini tetap legal digunakan di jalan raya, dan akan bersaing di kelas 2WD American Rally Association (ARA). Secara konstruksi, Civic Type R HRC Rally XP berangkat dari Civic Type R FL5 versi standar, yang dikenal sebagai salah satu hot hatch paling bertenaga di dunia. Model dasarnya dibekali mesin 2. 0 liter VTEC Turbo 4-silinder dengan tenaga mencapai 315 hp dan torsi 420 Nm, disalurkan ke roda depan melalui transmisi manual 6-percepatan. Mobil ini menggunakan sasis dan aerodinamika yang dirancang khusus untuk stabilitas di kecepatan tinggi, sekaligus memberikan kendali presisi di tikungan. Dengan basis tersebut, HRC menambahkan beragam komponen keselamatan dan performa balap, termasuk camber/caster plate, oil cooler kit, intercooler, radiator dengan sistem pendinginan aliran balik, differential pelat kopling, komponen suspensi, dan ventilasi kap mesin TCR. Selain itu, versi reli ini juga dibekali komponen prototipe, seperti rem khusus untuk roda reli, tuas transmisi baru, rem tangan hidrolik berbahan serat karbon, dan knalpot custom. Untuk menghadapi medan berat, mobil ini dilengkapi subframe tubular, pelindung bawah bodi aluminium, serta peredam kejut khusus reli. Honda menegaskan, Civic Type R HRC Rally XP bukan sekadar proyek eksperimental. Mobil ini tengah dievaluasi sebagai langkah awal menuju program balap reli komersial HRC di masa depan, sekaligus simbol penyatuan antara warisan mobil touring Honda dan inovasi performa ekstrem di dunia reli."
https://otomotif.kompas.com/read/2025/09/03/094200015/pilih-dashcam-terbaik-untuk-kendaraan-anda--tips-dan-rekomendasi,Otomotif,Aksesoris,2025-09-03 09:42:00,Pilih Dashcam Terbaik untuk Kendaraan Anda: Tips dan Rekomendasi.,"keamanan berkendara, aksesoris mobil, Dashcam , Reggy Gemini","Bogor, - Di era teknologi yang terus berkembang, keberadaan aksesori tambahan pada mobil menjadi semakin penting. Salah satunya adalah dashcam, kamera yang dipasang untuk merekam situasi di jalan saat berkendara, baik dari arah depan, belakang, maupun kabin. Kini, pasaran menawarkan beragam merek dashcam dengan harga yang bervariasi. Dari produk yang terjangkau dengan harga ratusan ribu Rupiah hingga yang berkualitas tinggi di kisaran belasan juta Rupiah. Reggy, Pemilik Tempat Aksesoris Mobil Gemini di Bogor, menjelaskan bahwa para pemilik mobil dapat memilih dashcam sesuai dengan kebutuhan mereka. ""Spesifikasi minimal yang jelas resolusi kameranya sudah agak bagus. Ada beberapa merek entry level, itu juga sudah bagus, 1080p, FHD cukup itu,"" ujar Reggy saat diwawancarai pada Selasa (2/9/2025). Dengan berbagai pilihan yang tersedia di pasaran, dashcam kini hadir dalam berbagai jenis. Terdapat model yang hanya merekam dari arah depan, dual-channel (depan-belakang), hingga yang dilengkapi tiga kamera (depan-belakang-kabin). Pilihan dashcam baru di GIIAS 2025""Dashcam dari Rp 400. 000-an juga ada, yang arah depan saja. Tapi kembali lagi kebutuhannya. Misal untuk merekam kejadian, kadang ada yang untuk vlog, jadi ambil kameranya dari dashcam,"" jelas Reggy. Bagi pemilik kendaraan yang memiliki sopir, pemasangan dashcam dengan tiga kamera bisa menjadi pilihan yang tepat. Hal ini tidak hanya bertujuan untuk memastikan keamanan, tetapi juga dapat berfungsi sebagai tambahan bukti jika terjadi kecelakaan. Dengan demikian, pemilik kendaraan bisa mengetahui apakah insiden tersebut disebabkan oleh kelalaian sopir atau faktor lain. Dengan demikian, investasi pada dashcam menjadi langkah bijak untuk menjaga keselamatan dan memberikan ketenangan pikiran bagi pengemudi serta pemilik kendaraan."
https://otomotif.kompas.com/read/2025/09/03/112200215/dashcam-dengan-fitur-cut-off--menjaga-aki-tetap-awet,Otomotif,Aksesoris,2025-09-03 11:22:00,Dashcam dengan Fitur Cut-Off: Menjaga Aki Tetap Awet.,"aki mobil, Keamanan kendaraan, Dashcam , fitur cut-off","Di era teknologi yang semakin maju, penggunaan dashcam menjadi salah satu aksesori mobil yang sangat diminati oleh pemilik kendaraan. Tidak hanya berfungsi sebagai alat perekam momen, dashcam juga sangat berguna dalam situasi darurat seperti kecelakaan. Dengan kemampuannya merekam kejadian di sekitar mobil, dashcam dapat menjadi bukti yang krusial dalam menyelesaikan masalah hukum dan asuransi. Bagi mereka yang baru mengenal dashcam, muncul pertanyaan umum: Apakah pemasangan dashcam dapat membuat aki mobil soak? Reggy, pemilik Pusat Aksesoris Mobil Gemini di Bogor, menjelaskan bahwa dashcam biasanya dilengkapi dengan fitur cut-off yang berfungsi untuk menjaga tegangan aki agar tetap aman. ""Jadi, saat mobil parkir, setelah mesin mati, dashcam akan tetap merekam. Cuma ada cut off-nya, sampai batas mobil itu bisa starter biasanya, di 12 sekian volt, menjaga aki enggak sampai habis,"" ungkap Reggy pada Selasa (2/9/2025). Dengan fitur ini, pemilik mobil tidak perlu khawatir aki akan soak, karena dashcam akan berhenti merekam sebelum tegangan aki terlalu rendah. Reggy juga menjelaskan bahwa tidak semua dashcam memiliki fitur cut-off. Ada model dashcam yang akan mati bersamaan dengan mati mesin mobil. ""Cuma ada beberapa orang yang ingin kondisi lagi parkir pun tetap merekam. Kan enggak tahu namanya mobil ditinggalin, tiba-tiba kejadian apadi mobilnya,"" katanya. Bagi pemilik kendaraan yang ingin agar dashcam tetap berfungsi saat mobil diparkir, pemilihan model yang tepat menjadi sangat penting. Namun, perlu diingat bahwa saat mobil diparkir, dashcam tidak merekam secara terus-menerus. Sebagian besar dashcam akan merekam selama dua hingga tiga jam atau hingga mencapai batas cut-off. Ini bertujuan agar aki tetap dalam keadaan baik dan mobil masih dapat dinyalakan ketika diperlukan. RAVEL Dashcam BlackVue di GJAW 2024 Menggunakan dashcam dapat memberikan rasa aman bagi pemilik kendaraan. Dengan pilihan model yang beragam dan adanya fitur cut-off pada banyak dashcam, kekhawatiran akan aki mobil yang soak bisa diminimalisir. Pastikan untuk memilih dashcam yang sesuai dengan kebutuhan dan karakteristik penggunaan kendaraan Anda. Investasi dalam dashcam bukan hanya untuk momen-momen berharga, tetapi juga untuk keselamatan dan keamanan kendaraan Anda di jalan."
https://otomotif.kompas.com/read/2025/09/03/192100015/cara-merawat-audio-mobil-agar-awet-dan-suara-tetap-jernih,Otomotif,Aksesoris,2025-09-03 19:21:00,Cara Merawat Audio Mobil Agar Awet dan Suara Tetap Jernih.,"suara, audio mobil, tuning, Perawatan","Keawetan audio mobil menjadi perhatian penting bagi pemilik yang ingin menikmati kualitas suara jangka panjang. Banyak faktor yang memengaruhi umur pakai sistem audio, mulai dari kualitas speaker, head unit, hingga cara tuning yang diterapkan. Selain itu, kondisi penggunaan sehari-hari seperti panas, kelembapan, dan intensitas pemakaian juga turut menentukan daya tahan perangkat audio. Menurut Suyoto, pemilik Serpong Audio Tuning di Tangerang, usia pakai audio mobil sangat bervariasi tergantung material dan frekuensi penggunaan. “Kalau dipakai normal dan dirawat, audio bisa awet 8–10 tahun. Speaker biasanya yang paling cepat aus, apalagi kalau sering dipakai full bass atau volumenya tinggi terus-menerus. Head unit relatif lebih tahan lama, tapi chip dan komponennya juga punya batas umur, ” kata Suyoto di Tangerang belum lama ini. Suyoto menambahkan, kondisi fisik speaker seperti karet yang menahan membran sering kali menjadi indikator pertama audio mulai menurun. “Kalau karetnya kering atau mulai pecah, suaranya sudah berbeda. Itu wajar karena umur pakai, bukan karena kualitasnya jelek, ” ujarnya. Selain itu, tuning juga berpengaruh terhadap daya tahan audio. Tuning yang tepat membuat speaker standar terdengar lebih premium tanpa membebani komponen, sedangkan tuning yang terlalu agresif atau tidak tepat justru bisa mempercepat keausan. Untuk menjaga keawetan, Suyoto menyarankan agar pemilik mobil memperhatikan penggunaan volume, frekuensi bass, serta menjaga kabin tetap kering dan bersih dari debu yang dapat masuk ke speaker. Dengan perawatan yang tepat, audio mobil bisa tetap enak didengar dalam waktu bertahun-tahun meski digunakan secara rutin."
https://otomotif.kompas.com/read/2025/09/12/170100315/tren-baru-pabrikan-mobil-pakai-sistem-audio-merek-ternama,Otomotif,Aksesoris,2025-09-12 17:01:00,"Tren Baru, Pabrikan Mobil Pakai Sistem Audio Merek Ternama.","Audio, mobil , Audio system, Audio system mobil","Produsen mobil kini semakin sering menggandeng merek audio ternama untuk menyematkan sistem suara bawaan (OEM) di kendaraan. Mulai dari Bose, Yamaha, hingga JBL, sistem audio branded menjadi daya tarik tambahan, terutama pada mobil- mobil kelas menengah hingga premium. Namun, bagaimana sebenarnya kualitas sistem audio yang langsung ditanamkan oleh pabrikan ini? Edy Susanto, pemilik Cartens Audio Jakarta, mengatakan, kualitas sistem audio pabrikan yang bekerja sama dengan merek terkenal cukup baik, tapi tergantung pada pendekatan dan keseriusan brand tersebut saat menyesuaikan sistem audio untuk masing-masing model kendaraan. ""Tergantung, ya. Misalnya saya tes yang BMW Seri 7, contohnya i7, itu bagus. BW-nya memang dibikin bener,"" kata Edy, yang ditemui belum lama ini. ""Yang tadi G70 juga, pas kita bongkar, dia bilang, 'Kita nggak main-main, ini bikin audionya juga. ' Jadi memang ada beberapa yang dibikin secara serius dan hasilnya bagus,"" ujar Edy. Untuk diketahui, BW (bandwidth) dalam dunia audio mengacu pada rentang frekuensi yang dapat dihasilkan oleh sistem suara. Semakin lebar bandwidth-nya, semakin kaya dan detail suara yang bisa dinikmati pengguna dari nada rendah (bass) hingga tinggi (treble). Edy menyebutkan, meski beberapa pabrikan memberikan perhatian lebih pada kualitas audio, tetap saja ada batasan, terutama soal biaya. ""Tapi ya balik lagi, pabrikan pasti punya pertimbangan biaya. Misalnya saya tes kemarin yang Destinator bagus, Yamaha yang Ultimate (Premium),"" katanya. ""Saya tes Destinator pas di Spark, cukup bagus. Walaupun sistemnya simpel banget, cuma speaker Yamaha, pakai DSP MP, 4 channel, tanpa subwoofer. Oke lah,"" kata Edy. ""Tapi kan, kalau customer bilang, 'Ah, tapi harganya beda nih Ultimate, itu 30 juta, ' ya mendingan gue beli aftermarket 30 juta. Balik lagi ke selera,"" ujarnya. Namun, ia juga mengingatkan bahwa tidak semua sistem aftermarket otomatis lebih baik. Bahkan, ada beberapa sistem audio bawaan pabrikan dari merek ternama yang dianggap kurang memuaskan. ""Tapi kalau ditanya, 'Ada nggak aftermarket yang jelek? ' Ada. Land Cruiser. Dengan JBL-nya, jelek sekali. Jadi kadang-kadang ada merek, ya customer yang udah biasa denger pasti bisa tau,"" kata Edy."
