url,category,subcategory,tanggal_publish,judul_berita,tags,konten_berita
https://otomotif.kompas.com/read/2025/11/05/170404915/pabrikan-ini-jadi-partner-ban-di-gran-turismo-7-dan-world-series,Otomotif,Feature,2025-11-05 17:04:04,Pabrikan ini Jadi Partner Ban di Gran Turismo 7 dan World Series.,"Ban mobil, Dunlop, game balap mobil, Gran Turismo 7, Kerja sama Dunlop dan Gran Turismo 7","Dunlop resmi hadir di dunia virtual melalui game simulasi balap Gran Turismo 7 di PlayStation 4 dan PlayStation 5, serta ajang Gran Turismo World Series. Kerja sama ini menjadi langkah strategis Dunlop dalam memperkuat citra global di dunia otomotif dan motorsport. Tujuannya untuk menjembatani pengalaman berkendara antara dunia nyata dan digital. Dikenal dengan sejarah panjang di dunia balap, Dunlop kini membawa keahliannya ke ranah simulasi melalui kolaborasi dengan Gran Turismo besutan Polyphony Digital Inc. anak perusahaan Sony Interactive Entertainment. DUNLOP Kerja sama Dunlop dengan Gran Turismo 7 Mulai dari putaran kedua Gran Turismo World Series 2025, Dunlop menjadi pemasok ban resmi untuk seluruh rangkaian kejuaraan. Nantinya, logo Dunlop akan tampil di lintasan, museum “ Brand Central ”, hingga tersedia sebagai opsi ban di Tuning Shop. Selain itu, pemain juga bisa mengikuti time trial bertema Dunlop yang akan hadir lewat pembaruan mendatang. Langkah ini disebut sebagai bentuk inovasi yang memperkaya pengalaman balap virtual bagi para penggemar motorsport. DUNLOP Kerja sama Dunlop dengan Gran Turismo 7 “Kami merasa terhormat menjadi bagian dari Gran Turismo. Kolaborasi ini menggabungkan teknologi simulasi dan pengalaman nyata kami di lintasan, ” ujar Hiroshi Hamada, Senior Executive Officer Sumitomo Rubber Industries, Ltd. dalam keterangan resmi, Rabu (5/11/2025). Produser Gran Turismo, Kazunori Yamauchi, menambahkan bahwa Dunlop adalah merek bersejarah dengan semangat inovasi tinggi. “Kami berharap kemitraan ini bisa membawa balapan dan ban Dunlop ke generasi penggemar berikutnya, ” kata Yamauchi."
https://otomotif.kompas.com/read/2025/11/06/072200315/adu-harga-lcgc-november-2025-mulai-banyak-diskon-jelang-akhir-tahun,Otomotif,Feature,2025-11-06 07:22:00,"Adu Harga LCGC November 2025, Mulai Banyak Diskon Jelang Akhir Tahun.","Honda, Daihatsu, Harga mobil baru, LCGC, Toyota, CVT, diskon","Mobil murah ramah lingkungan atau low cost green car (LCGC) masih menjadi incaran sebagian besar masyarakat di Indonesia. Selain karena harga yang terjangkau dan irit bahan bakar, saat ini LCGC juga telah mengalami perkembangan yang signifikan, baik dari segi fitur maupun performa. Contohnya dari sisi teknis, kini banyak model LCGC yang dipasarkan sudah menggunakan transmisi CVT. Jika dulu jenis transmisi ini hanya dimiliki Honda Brio Satya, kini duet Toyota Agya dan Daihatsu Ayla pun sudah menggunakannya. Kondisi tersebut tentu membuat LCGC sedikit naik kelas, meski tak bisa dipungkiri bahwa dari segi harga, banderol unit barunya kini juga ikut terkerek naik. New Toyota Calya Bicara soal harga, bagi yang sedang menimbang untuk membeli LCGC, memasuki November 2025, hasil pantauan redaksi dari situs resmi masing-masing merek menunjukkan tidak ada kenaikan harga. Terlihat banderolnya masih stabil seperti bulan lalu. Menariknya, menjelang akhir tahun, biasanya calon konsumen diuntungkan dengan berbagai program penjualan menarik, seperti diskon dan promo pembelian lainnya. Dari hasil, Honda memberikan potongan cukup besar untuk Brio Satya, yakni Rp 30 juta untuk pembelian tunai dan Rp 35 juta untuk pembelian secara kredit. Sementara untuk LCGC keluaran Toyota, diberikan diskon yang tak kalah menarik, yakni Rp 10 juta untuk Calya dan Agya. Penasaran dengan harga terbaru LCGC pada November 2025? Berikut daftarnya untuk wilayah Jakarta. Honda - Brio Satya S MT Rp 170. 400. 000 - Brio Satya E MT Rp 185. 500. 000 - Brio Satya E CVT Rp 202. 500. 000 Toyota - Agya 1. 2 E M/T Rp 173. 200. 000 - Agya 1. 2 G M/T Rp 180. 900. 000 - Agya 1. 2 G CVT Rp 197. 100. 000 - Agya Stylix 1. 2 G CVT With GR Parts Aero Package Rp 200. 600. 000 - Calya 1. 2 E STD M/T Low Rp 167. 000. 000 - Calya 1. 2 E M/T STD Rp 169. 600. 000 - Calya 1. 2 E M/T Rp 172. 500. 000 - Calya 1. 2 G M/T Rp 178. 200. 000 - Calya 1. 2 G A/T Rp 192. 600. 000 Daihatsu - Ayla 1. 0 M Rp 138. 500. 000 - Ayla 1. 0 X MT Rp 151. 400. 000 - Ayla 1. 0 X MT ADS Rp 157. 300. 000 - Ayla 1. 0 X CVT Rp 171. 400. 000 - Ayla 1. 0 X CVT ADS Rp 177. 300. 000 - Ayla 1. 2 R MT Rp 168. 500. 000 - Ayla 1. 2 R MT ADS Rp 174. 400. 000 - Ayla 1. 2 R CVT Rp 188. 500. 000 - Ayla 1. 2 R CVT ADS Rp 194. 400. 000 - Sigra 1. 0 D MT Rp 141. 500. 000 - Sigra 1. 0 M MT Rp 152. 100. 000 - Sigra 1. 2 X MT Rp 159. 800. 000 - Sigra 1. 2 X AT Rp 173. 100. 000 - Sigra 1. 2 X MT DLX Rp 165. 400. 000 - Sigra 1. 2 X AT DLX Rp 178. 600. 000 - Sigra 1. 2 R MT Rp 166. 500. 000 - Sigra 1. 2 R AT Rp 181. 300. 000 - Sigra 1. 2 R MT DLX Rp 170. 300. 000 - Sigra 1. 2 R AT DLX Rp 185. 100. 000"
https://otomotif.kompas.com/read/2025/11/07/073100115/daftar-harga-dan-diskon-lmpv-november-2025-mana-yang-paling-menarik-,Otomotif,Feature,2025-11-07 07:31:00,"Daftar Harga dan Diskon LMPV November 2025, Mana yang Paling Menarik?","diskon, harga mobil, ertiga, Toyota, LMPV, Xenia, Suzuki , avanza, potongan, November 2025","Memasuki November 2025, harga mobil di segmen low multi purpose vehicle (LMPV) terpantau masih stabil. Tak ada revisi atau kenaikan harga menjelang akhir tahun. Meski saat ini pasar SUV ringkas terlihat cukup tumbuh, segmen LMPV tetap menjadi pasar yang “gemuk” di Indonesia. Hal ini tak lepas dari kebutuhan masyarakat yang cenderung mencari mobil berkapasitas tujuh penumpang, dengan harga terjangkau dan efisiensi bahan bakar yang baik. Pilihan modelnya pun beragam. Hampir semua merek mobil besar di Indonesia memiliki produk di kelas ini. Sebut saja Toyota Avanza, Daihatsu Xenia, Suzuki Ertiga, Mitsubishi Xpander, dan lainnya. Menariknya, selain harga yang masih stabil, pada November ini mulai banyak diler menawarkan program penjualan untuk LMPV. Program yang ditawarkan juga beragam, dari cicilan ringan, bunga rendah, hingga potongan harga atau diskon. Mitsubishi Xpander di GIIAS 2025 Salah satunya datang dari Suzuki, yang memberikan potongan harga hingga Rp 27 juta untuk Ertiga tipe GL. Namun, menurut keterangan tenaga penjualnya, diskon tersebut hanya berlaku untuk unit sisa stok. Sementara itu, bagi yang tertarik dengan Toyota Avanza dan Veloz, diler Toyota di Jakarta juga memberikan potongan harga, tergantung tipe yang dipilih. “Avanza E Rp 20 juta, Avanza G Rp 21 juta, dan Veloz Rp 21 juta, ” kata seorang tenaga penjual Toyota, beberapa hari lalu. Bagi yang penasaran dengan harga terbaru LMPV pada November ini, berikut daftar lengkapnya untuk wilayah Jakarta: Toyota Daihatsu Suzuki Wuling Mitsubishi Hyundai Nissan"
https://otomotif.kompas.com/read/2025/11/07/093100215/lebih-dekat-dengan-jaecoo-j5-ev-suv-listrik-rp-200-jutaan-video-,Otomotif,Feature,2025-11-07 09:31:00,"Lebih Dekat dengan Jaecoo J5 EV, SUV Listrik Rp 200 Jutaan (Video).","video, mobil listrik, JAECOO J5 EV","Datang sebagai pilihan baru di segmen mobil listrik Rp 200 jutaan, Jaecoo J5 EV tak hanya menawarkan harga menarik, tapi juga fitur serta teknologi yang bisa dibilang menggoda. Apalagi mobil ini hadir dalam visual sport utility vehicle (SUV) ringkas, yang memang saat ini pasarnya sedang bergairah. Masuk ke interior, kesan mewah langsung terasa dari deretan panel digital serta layar sentuh berdimensi besar. Selain itu, aksen soft touch juga memberikan nuansa modern. Bicara soal tenaga, J5 EV dibekali motor listrik bertenaga 155 kW atau setara 207 Tk, dengan torsi 288 Nm. Pabrikan mengklaim SUV ini mampu berakselerasi dari 0–100 kpj dalam waktu 7, 3 detik. Nah, bagi yang penasaran lebih detail soal Jaecoo J5 EV, simak langsung videonya di kanal."
https://otomotif.kompas.com/read/2025/11/07/154100715/mobil-bekas-banjir-dijual-murah-apakah-masih-layak-dibeli-,Otomotif,Feature,2025-11-07 15:41:00,"Mobil Bekas Banjir Dijual Murah, Apakah Masih Layak Dibeli?","mobil bekas, mobil bekas murah, beli mobil bekas, beli mobil bekas yang pernah terendam banjir","Mobil bekas memang masih menjadi salah satu alternatif bagi konsumen dengan bujet terbatas namun ingin memiliki kendaraan pribadi. Apalagi mobil bekas yang pernah terendam banjir, biasanya dijual dengan harga jauh lebih murah dibandingkan mobil normal. Kondisi ini tentu menggoda bagi sebagian pembeli yang ingin mendapatkan kendaraan dengan harga miring. Lantas, apakah mobil bekas yang pernah terendam banjir masih layak untuk dibeli? Irvan Ardhi Nugroho, Kepala Inspektor PT Inspeksi Mobil Jogja, mengatakan, tidak menyarankan untuk membeli mobil bekas yang pernah terendam banjir karena risiko kerusakan bisa datang sewaktu-waktu. Meski mobil sudah dibersihkan dan tampak normal, komponen kelistrikan di dalamnya bisa saja masih menyimpan masalah yang sulit dideteksi sejak awal. “Tidak direkomendasikan, karena termasuk hal riskan kalau misal ada masalah di kelistrikan mobil bisa jadi bom waktu di kemudian hari, ” katanya, Kamis (6/11/2025). Sementara, Iwan, pemilik bengkel mobil Iwan Motor Auto Clinic, Solo mengatakan, jika ingin membeli mobil bekas yang pernah terendam banjir perlu ada pertimbangan yang harus diperhatikan. “Ada beberapa pertimbangan, kalau cari barang bagus pasti gak bakal dapat. Tapi kalau mau cari murah mungkin bisa, tapi kalau diperbaiki jatuhnya mahal juga, ” kata Iwan. Iwan juga menjelaskan, membeli mobil bekas yang pernah terendam banjir memang bisa mendapatkan harga murah, namun ada risiko masalah di kemudian hari. “Biasanya mobil bekas banjir dijual dengan harga murah. Jadi harus hati-hati, jangan tergiur harga murah, pastikan dulu kondisinya. Kalau sudah tahu bekas banjir dan bisa terukur biayanya ya silahkan, ” kata Iwan. Meski begitu, Iwan menyarankan, sebaiknya jangan membeli mobil bekas yang pernah terendam banjir karena jangka panjang juga akan banyak masalah."
https://otomotif.kompas.com/read/2025/11/07/194100115/penanganan-tepat-setelah-mobil-terjang-banjir-cegah-turun-mesin,Otomotif,Feature,2025-11-07 19:41:00,"Penanganan Tepat Setelah Mobil Terjang Banjir, Cegah Turun Mesin.","mobil kena banjir, Mobil menerjang banjir, Perawatan mobil setelah menerjang banjir","Setelah menerjang banjir, mobil tak selalu mengalami kerusakan yang bikin mobil mogok. Ketinggian air menentukan, apakah air akan masuk ke ruang bakar atau tidak. Meski tidak mogok, bukan berarti mobil sudah bisa diartikan selamat, pasalnya ada kemungkinan kerusakan lainnya, yakni air masuk ke ruang oli. Dengan bercampurnya air dengan oli, maka kerusakan tidak akan muncul dalam waktu singkat, melainkan secara perlahan dan akhirnya membuat suara mesin kasar. Imun, pemilik bengkel Spesialis Ford Trucuk Klaten mengatakan masalah air bercampur dengan oli mesin kerap tak disadari oleh pengguna mobil. “Pasalnya, tidak ada indikator yang menginformasikan ke pengguna bahwa kualitas oli sudah jelek akibat air, tahu-tahu suara mesin jadi kasar atau performa turun, dan pemilik baru ingat bahwa tempo hari pernah menerjang banjir, ” ucap Imun, Jumat (7/11/2025). Seharusnya, setelah mobil menerjang banjir, konsumen langsung memeriksa oli mesin dan transmisi. Pastikan warnanya masih bagus dan tak ada tanda-tanda air di dalam oli. “Bila oli mesin atau transmisi yang tercampur air, maka oli harus diganti, bila perlu lakukan penggantian beberapa kali sampai sia air benar-benar terbuang, ” ucap Imun. Bila pemeriksaan oli ini terlewat, dan ternyata kondisinya sudah tercampur air, maka penyakit mobil akan muncul semacam bom waktu. Seperti mobil tak mau jalan, ternyata oli transmisinya sudah jelek. Selain itu, bisa juga suara mesin menjadi kasar karena pelumasan tidak optimal. Jika sudah demikian, solusinya adalah turun mesin untuk ganti komponen yang aus. “Bila penanganan tepat, oli dan filter langsung diperiksa atau diganti setelah menerobos banjir, maka risiko turun mesin atau transmisi bisa dihindari, sehingga biasa perawatan tak akan membengkak, ” ucap Imun. Selain soal pelumas, setelah mobil menerjang banjir juga berpotensi mengalami gangguan kompresi karena water hammer. Komponen seperti lengan piston, dan gasket kepala silinder bisa bocor. Hardi Wibowo, pemilik bengkel Spesialis Nissan - Honda Yogyakarta mengatakan kompresi mesin yang turun tak selalu membuat mobil mogok, tapi bisa menimbulkan gejala ringan. “Seperti mesin brebet kecil, kadang ini tidak disadari oleh konsumen, tapi sebenarnya kompresi sudah turun, dan lama-lama bisa makin parah dan menyebabkan performa nge- drop, ” ucap Hardi, Kamis (6/11/2025). Nah, dengan penanganan tepat di atas, maka risiko turun mesin dan transmisi bisa berkurang."
https://otomotif.kompas.com/read/2025/11/08/083100615/adegan-truk-meledak-di-film-abadi-nan-jaya-ini-faktanya,Otomotif,Feature,2025-11-08 08:31:00,"Adegan Truk Meledak di Film Abadi Nan Jaya, Ini Faktanya.","truk meledak, abadi nan jaya, film abadi nan jaya, film zombi indoneisa, Solar tak mudah terbakar","Ada kejadian menarik di adegan film Abadi Nan Jaya yakni ketika bahan bakar minyak (BBM) truk bocor dan akhirnya meledak saat terkena percikan api dari petasan. Sepintas kejadian ini tampak realistis, padahal faktanya tak semua BBM mudah terbakar bila kena api. Seperti BBM truk yang bermesin diesel tersebut, harusnya tak mudah terbakar bila menetes karena bocor. Sejak perilisannya pada 23 Oktober 2025, film karya sutradara Kimo Stamboel ini telah ditonton lebih dari 11 juta kali di seluruh dunia. Ahli Konversi Energi dari Fakultas Teknik dan Dirgantara Institut Teknologi Bandung Tri Yuswidjajanto Zaenuri mengatakan solar yang biasa dipakai untuk BBM truk seharusnya tak mudah terbakar bila bertemu percikan api. “Solar itu sulit menguap, sehingga sulit terbakar karena percikan api, karena yang mudah terbakar itu uap bahan bakar bercampur udara, ” ucap Tri, Sabtu (8/11/2025). Tri memberikan contoh BBM yang mudah menguap, salah satunya, etanol. Etanol mudah terbakar karena mudah menguap. Apinya tidak tampak karena berwarna putih dan ada di atas bahan bakar. “Bensin juga begitu, mudah terbakar tapi tidak semudah etanol, karena sedikit lebih sulit menguap dibanding etanol, apinya diatas bensin, tapi lebih rendah dari etanol, ” ucap Tri. Sementara itu, di dalam ruang bakar mesin diesel yang ada pada truk, solar cair diubah menjadi kabut bahan bakar oleh injektor bertekanan tinggi. “Sehingga kabut solar ini menjadi lebih mudah terbakar ketika bertemu udara dan panas melebihi ignition temperature-nya, ” ucap Tri. Sebagai tambahan informasi, titik nyala solar, atau suhu minimum ketika uap solar mulai bisa terbakar oleh sumber api ada di rentang suhu 52 - 96 derajat Celcius. Sementara solar yang mengalir keluar dari tangki BBM tak akan mudah terbakar karena percikan api. Sehingga, adegan di film Abadi Nan Jaya tersebut tidak relevan dengan fakta ilmiah."
https://otomotif.kompas.com/read/2025/11/08/094100515/prosedur-lengkap-bayar-pajak-kendaraan-tahunan-di-samsat,Otomotif,Feature,2025-11-08 09:41:00,Prosedur Lengkap Bayar Pajak Kendaraan Tahunan di Samsat.,"pengesahan stnk, bayar pajak kendaraan tahunan, Cara bayar pajak kendaraan di samsat","Masyarakat perlu memahami prosedur pembayaran pajak kendaraan bermotor (PKB) tahunan agar lebih mudah dalam prosesnya. Seperti membawa semua perlengkapan dokumen, urutan dan pastikan semua dilakukan dengan lengkap. Pasalnya, bila proses pembayaran tidak dilakukan dengan lengkap akan membuat hak masyarakat tak didapatkan seutuhnya, seperti STNK dan pengesahannya sebagai bukti pembayaran pajak. Tak hanya itu, STNK tanpa pengesahan juga berpeluang membuat pengendara kena tilang saat ada pemeriksaan oleh petugas, karena kendaraan dianggap ilegal untuk dikendarai. AKBP Christopher Adhikara Lebang, Kasubdit Gakkum Ditlantas Polda Jateng mengatakan penegakkan hukum oleh petugas di lapangan mengacu pada Undang-undang Lalu Lintas dan Angkutan Jalan. “Dalam Pasal 288 ayat 1, bahwa setiap orang yang mengemudikan kendaraan bermotor di jalan tidak membawa STNK yang disahkan oleh kepolisian bisa kena tilang, ” ucap Lebang, belum lama ini. Pada pasal tersebut, menurut Lebang, pidana yang diancamkan berupa kurungan paling lama dua bulan atau denda paling banyak Rp 500. 000. PMJNews Cara mengurus STNK hilang 2025 sesuai aturan resmi Polri. Masyarakat perlu mempersiapkan semua dokumen yang dibutuhkan dalam proses pembayaran pajak. Berikut dokumen yang wajib disiapkan: Setelah semua dokumen lengkap, masyarakat bisa datang ke Samsat sesuai domisili kendaraan atau gunakan layanan Samsat keliling / drive-thru jika hanya membayar pajak tahunan, atau bukan ganti plat 5 tahunan. Serahkan dokumen ke loket pendaftaran. Petugas akan memeriksa kelengkapan dokumen dan mencocokkan data kendaraan. Jika dokumen lengkap, nomor antrean dan tagihannya. Bayar pajak kendaraan di loket kasir atau ATM yang terhubung Samsat online (tergantung wilayah). Komponen yang dibayar meliputi: Selanjutnya, masyarakat perlu mengambil STNK yang telah diperpanjang. Setelah pembayaran diverifikasi, STNK baru yang telah disahkan dengan masa berlaku 1 tahun ke depan, dan tanda bukti pembayaran pajak akan diberikan oleh petugas. Sebagai tambahan informasi, khusus untuk pembayaran pajak 5 tahunan, masyarakat juga perlu melakukan cek fisik kendaraan, verifikasi data di loket BPKB/STNK, dan melanjutkan pembayaran dan penerbitan plat nomor baru. Nah, itu tadi prosedur lengkap bayar pajak kendaraan bermotor tahunan di kantor Samsat. Jangan sampai ada tahapan yang terlewat agar hak masyarakat didapatkan sepenuhnya."
https://otomotif.kompas.com/read/2025/11/08/102100515/stnk-yang-tak-disahkan-bisa-kena-tilang-saat-pemeriksaan,Otomotif,Feature,2025-11-08 10:21:00,STNK yang Tak Disahkan Bisa Kena Tilang Saat Pemeriksaan.,"STNK, pengesahan stnk, bayar pajak kendaraan tahunan, Prosedur bayar pajak kendaraan tahunan, STNK Sah","Pengesahan surat tanda nomor kendaraan (STNK) dan pembayaran pajak tahunan merupakan dua hal berbeda. Berdasarkan prosedurnya, setelah wajib pajak bayar PKB tahunan, masih harus mengesahkan STNK di kepolisian. Sehingga, meski sudah bayar pajak, bila STNK belum disahkan atau tanpa stempel pada kolom pengesahan, maka akan berpeluang kena tilang saat ada pemeriksaan oleh petugas. STNK tanpa pengesahan bisa dijumpai ketika membeli kendaraan bekas karena prosedur pembayaran PKB yang tidak rampung. AKBP Christopher Adhikara Lebang, Kasubdit Gakkum Ditlantas Polda Jateng mengatakan penegakkan hukum oleh petugas di lapangan mengacu pada Undang-undang Lalu Lintas dan Angkutan Jalan. “Dalam Pasal 288 ayat 1, bahwa setiap orang yang mengemudikan kendaraan bermotor di jalan tidak membawa STNK yang disahkan oleh kepolisian bisa kena tilang, ” ucap Lebang, belum lama ini. Pada pasal tersebut, menurut Lebang, pidana yang diancamkan berupa kurungan paling lama dua bulan atau denda paling banyak Rp 500. 000. Berikut ini fungsi pengesahan STNK oleh pihak kepolisian: Kepala Bidang PKB Bapenda Jawa Tengah, Danang Wicaksono mengatakan, Bapenda dengan kepolisian merupakan instansi yang berbeda, dan memiliki peraturan masing-masing. “Pengendara yang tidak membawa STNK sah bisa kena tilang, karena STNK berlaku 5 tahun dan wajib disahkan ulang setiap tahun, dan jatuh temponya bertepatan dengan jatuh tempo bayar pajak, ” ucap Danang, belum lama ini."
https://otomotif.kompas.com/read/2025/11/08/130100215/beda-perawatan-mobil-hybrid-dan-konvensional-ini-penjelasan-ahli,Otomotif,Feature,2025-11-08 13:01:00,"Beda Perawatan Mobil Hybrid dan Konvensional, Ini Penjelasan Ahli.","hybrid, Mobil Hybrid, perawatan mobil, mobil konvensional","Seiring meningkatnya popularitas mobil hybrid di Indonesia, banyak pemilik kendaraan mulai mempertimbangkan untuk beralih ke teknologi ramah lingkungan ini. Namun, banyak yang masih bertanya-tanya apakah perawatannya berbeda dengan mobil konvensional, mengingat mobil hybrid memiliki sistem lebih kompleks yang menggabungkan mesin bensin dan motor listrik. Menjawab hal tersebut, Pakar otomotif dari Universitas Gadjah Mada (UGM), Jayan Sentanuhady, menjelaskan bahwa pada dasarnya mobil hybrid dan mobil konvensional memiliki pola perawatan yang serupa. “Mobil hybrid masih memiliki cara perawatan yang sama dengan mobil biasa, seperti ganti oli dan lain-lain, tambahannya perawatan baterai, motor listrik dan controller, ” katanya, Kamis (13/11/2025). Ia juga menegaskan bahwa oli mesin mobil hybrid cenderung lebih awet karena sistem mesinnya sering mati dan hidup secara otomatis berkat fitur start-stop, sehingga beban kerja mesin tidak seberat mobil konvensional. Sementara itu, Lung Lung, pemilik bengkel Dokter Mobil, menilai perbedaan utama antara mobil hybrid dan konvensional terletak pada sistem penggerak gandanya. ""Mobil hybrid butuh perawatan lebih detail, terutama sistem baterai dan inverter untuk menjaga kinerja optimal,"" kata Lung Lung, belum lama ini. Lung Lung menambahkan, penggunaan oli mesin yang sesuai spesifikasi juga sangat penting, sebab mesin hybrid sering beroperasi pada suhu lebih rendah dibandingkan mesin konvensional. ""Penggunaan oli mesin yang sesuai juga penting karena mesin sering beroperasi pada suhu yang lebih rendah dibandingkan mesin konvensional,"" ujarnya. Ia juga menyoroti sistem pengereman regeneratif yang harus diperiksa secara berkala agar proses pengisian daya baterai tetap efisien. ""Kalau rutin dicek, usia baterai bisa lebih panjang,"" katanya. Sementara, pada mesin konvensional, fokus utama perawatan lebih pada komponen mekanis seperti filter udara, busi, dan sistem pembuangan."
https://otomotif.kompas.com/read/2025/11/08/134100515/begini-cara-kerja-sistem-hybrid-di-wuling-darion-phev,Otomotif,Feature,2025-11-08 13:41:00,Begini Cara Kerja Sistem Hybrid di Wuling Darion PHEV.,"Mobil Hybrid, Wuling, mobil , PHEV, Wuling Darion PHEV","Wuling Darion PHEV hadir sebagai varian elektrifikasi terbaru di segmen MPV medium. Model ini memadukan mesin bensin dengan motor listrik yang bekerja sesuai kebutuhan daya dan kondisi jalan. Secara teknis, Darion PHEV mengandalkan mesin bensin 1. 490 cc Naturally Aspirated berteknologi Atkinson Cycle, berpadu dengan motor listrik bertenaga 195 Tk dan torsi 230 Nm. Mesin konvensionalnya sendiri menghasilkan 105 Tk pada 5. 800 rpm dan torsi 130 Nm pada 4. 600–5. 000 rpm. Keduanya dihubungkan melalui Dedicated Hybrid Transmission (DHT), sistem transmisi pintar yang memastikan perpindahan tenaga berjalan halus dan efisien. Sistem ini memungkinkan Darion PHEV beroperasi dalam tiga mode berbeda, yaitu EV murni, hybrid paralel, dan hybrid seri, secara otomatis menyesuaikan kebutuhan pengemudi. Foto: Wisnu Test drive Wuling Cortez Darion PHEV Product Planning Officer Wuling Motors, Aji Ibrahim, menjelaskan bahwa sistem pada Darion PHEV akan selalu mengutamakan motor listrik lebih dulu saat kedua sumber energi dalam kondisi penuh. “Jadi kalau nanti teman-teman mengoperasikan PHEV dalam kondisi bensin dan baterai terisi penuh, sistem tetap akan menggerakkan motor listrik atau EV terlebih dahulu,"" kata Aji saat peluncuran belum lama ini. Aji menerangkan bahwa EV akan bekerja lebih dulu. Baru kemudian pengguna bisa melakukan pengaturan, apakah mau menggunakan listrik murni, hybrid paralel, dan atau hybrid seri. ""Meskipun memilih mode hybrid, kalau baterainya 100 persen, kendaraan tetap akan berjalan dengan mode EV terlebih dahulu sampai batas sekitar 35 persen, selama force retention tidak diaktifkan,"" katanya. ""Namun, jika langsung memilih mode EV, maka sistem akan menggunakan tenaga listrik hingga sekitar 18 persen state of charge (SOC),"" katanya. ""Setelah itu, secara otomatis kendaraan akan berpindah ke mode hybrid. Dalam mode hybrid, mesin bensin akan ikut bekerja sekaligus mengisi kembali baterai hingga 35 persen, jika force retention tidak diaktifkan,"" ujarnya. Kalau force retention yaitu pengatur kapasitas baterai minimum agar daya listrik tidak habisdiaktifkan, kata Aji, pengguna bisa mengatur sendiri berapa persen SOC yang diinginkan, mulai dari 35 persen hingga 70 persen. Tenaga listrik Darion PHEV bersumber dari baterai 20, 5 kWh Lithium Iron Phosphate (LFP), yang mampu membawa mobil melaju hingga 125 km dalam mode EV murni (CLTC). Selain itu, kapasitas tangki bensin 52 liter membuat total jarak tempuh Darion PHEV jauh lebih panjang dibandingkan versi listrik murninya, Darion EV. Sama seperti varian EV, sistem penggerak mobil ini Front Wheel Drive (FWD), dengan suspensi depan McPherson dan belakang Multi-link Independent, menjaga kenyamanan berkendara baik di dalam maupun luar kota."
